4686811782185431,中国新闻网,Wed Sep 29 17:07:48 +0800 2021,#香港街头挂国旗迎国庆#【#香港市民挂国旗迎国庆# 街头五星红旗飘扬】国庆将至，香港的大街小巷悄然披上中国红，五星红旗和紫荆花旗交相辉映，欢乐祥和的节日气氛尽在其中。在香港元朗的主要道路两旁，迎风飘扬的1600面五星红旗经市民自发组织悬挂在沿街的灯柱之上。一香港市民表示，“我们应该很尊重她(国旗)，因为这个国旗是代表我们中国人的一个象征。祖国强大我们才有这么幸福的生活。”（记者 范思忆 梁源 罗嗣昱）@中新视频 中新视频的微博视频,香港 街头 挂 国旗 迎国庆 香港市民   五星红旗 飘扬 国庆 将至 大街小巷 悄然 披上 中国红 紫荆花 旗 交相辉映 欢乐祥和 节日 气氛 尽在 在香港 元朗 道路 两旁 迎风飘扬 1600 面 市民 自发 组织 悬挂 沿街 灯柱 之上 我们应该 尊重 代表 中国人 象征 祖国 强大 才有 幸福 生活 记者 范 思忆 梁源 罗嗣昱 中新 视频 微博,ns s v n nr ns x nr v t x i d v x nr n i i t n x x nr n f x m n n v v v f n f x a n x v n a x a vn n nr n nr nr ns n a,"香港 ns,街头 s,挂 v,国旗 n,迎国庆 nr,香港市民 ns,  x,五星红旗 nr,飘扬 v,国庆 t,将至 x,大街小巷 i,悄然 d,披上 v,中国红 x,紫荆花 nr,旗 n,交相辉映 i,欢乐祥和 i,节日 t,气氛 n,尽在 x,在香港 x,元朗 nr,道路 n,两旁 f,迎风飘扬 x,1600 m,面 n,市民 n,自发 v,组织 v,悬挂 v,沿街 f,灯柱 n,之上 f,我们应该 x,尊重 a,代表 n,中国人 x,象征 v,祖国 n,强大 a,才有 x,幸福 a,生活 vn,记者 n,范 nr,思忆 n,梁源 nr,罗嗣昱 nr,中新 ns,视频 n,微博 a"
4687042179498821,南枫翊,Thu Sep 30 08:23:18 +0800 2021,"一起祝祖国母亲生日快乐🎂❤️
#香港街头挂国旗迎国庆# 网页链接","祝 祖国 母亲 生日快乐 🎂 ❤ ️ 
 香港 街头 挂 国旗 迎国庆   网页 链接",v n n l x x x x ns s v n nr x n n,"祝 v,祖国 n,母亲 n,生日快乐 l,🎂 x,❤ x,️ x,
 x,香港 ns,街头 s,挂 v,国旗 n,迎国庆 nr,  x,网页 n,链接 n"
4687048415381220,云南共青团,Thu Sep 30 08:48:06 +0800 2021,【#香港街头挂国旗迎国庆#】明天国庆节，感受一下香港的国庆气氛！🇨🇳,香港 街头 挂 国旗 迎国庆 明天 国庆节 感受一下 国庆 气氛 🇨 🇳,ns s v n nr t t l t n x x,"香港 ns,街头 s,挂 v,国旗 n,迎国庆 nr,明天 t,国庆节 t,感受一下 l,国庆 t,气氛 n,🇨 x,🇳 x"
4687072042946794,香港胡迪警長,Thu Sep 30 10:21:59 +0800 2021,#香港街头挂国旗迎国庆# 五星紅旗迎風飄揚，唯有這中國紅🇨🇳最美，祖國生日快樂！ 香港胡迪警長的微博视频,香港 街头 挂 国旗 迎国庆   五星紅旗 迎風 飄揚 這 中國 紅 🇨 🇳 最美 祖國 生日快樂 胡迪 警長 微博 视频,ns s v n nr x x x x zg x zg x x a x x nr x a n,"香港 ns,街头 s,挂 v,国旗 n,迎国庆 nr,  x,五星紅旗 x,迎風 x,飄揚 x,這 zg,中國 x,紅 zg,🇨 x,🇳 x,最美 a,祖國 x,生日快樂 x,胡迪 nr,警長 x,微博 a,视频 n"
4687053999309074,香港董先生,Thu Sep 30 09:10:16 +0800 2021,#香港街头挂国旗迎国庆# 香港明天更好,香港 街头 挂 国旗 迎国庆   明天 更好,ns s v n nr x t d,"香港 ns,街头 s,挂 v,国旗 n,迎国庆 nr,  x,明天 t,更好 d"
4687070696835382,城N代_3o,Thu Sep 30 10:16:38 +0800 2021,"#香港街头挂国旗迎国庆#
减少内耗，共同发展，一致对外，护好我们的狗窝。
是不是理想状态","香港 街头 挂 国旗 迎国庆 
 减少 内耗 共同发展 对外 护好 狗窝 理想 状态",ns s v n nr x v n x s v n n n,"香港 ns,街头 s,挂 v,国旗 n,迎国庆 nr,
 x,减少 v,内耗 n,共同发展 x,对外 s,护好 v,狗窝 n,理想 n,状态 n"
4687070582277056,安迪唐的糖,Thu Sep 30 10:16:11 +0800 2021,#香港街头挂国旗迎国庆#反倒是内地，至少南京，好像街头很少看到以往路灯上挂的国旗，今年挂的比较多的是红灯笼还有那个什么结来着，国庆的氛围没有以往浓烈了，江宁马路上连灯笼都没有……@江宁婆婆,香港 街头 挂 国旗 迎国庆 内地 至少 南京 好像 以往 路灯 上挂 比较多 的是 红灯笼 结 国庆 氛围 浓烈 江宁 马路上 灯笼 婆婆,ns s v n nr n d ns v t n x x x n n t n a ns l n n,"香港 ns,街头 s,挂 v,国旗 n,迎国庆 nr,内地 n,至少 d,南京 ns,好像 v,以往 t,路灯 n,上挂 x,比较多 x,的是 x,红灯笼 n,结 n,国庆 t,氛围 n,浓烈 a,江宁 ns,马路上 l,灯笼 n,婆婆 n"
4687063196894526,其实是香蕉,Thu Sep 30 09:46:50 +0800 2021,"谁国庆七天打算睡过去了？？

我爸妈至今无法理解为什么我可以从晚上10点一觉睡到第二天中午12点才醒，醒的时候还睡眼惺忪神志不清。

但我就是可以啊😅

#香港街头挂国旗迎国庆#","国庆 七天 打算 睡过去 
 爸妈 理解 晚上 10 点 一觉 睡到 第二天 中午 12 醒 睡眼惺忪 神志不清 但我 😅 香港 街头 挂 国旗 迎国庆",t t v v x n v t m m d v m t m v i i x x ns s v n nr,"国庆 t,七天 t,打算 v,睡过去 v,
 x,爸妈 n,理解 v,晚上 t,10 m,点 m,一觉 d,睡到 v,第二天 m,中午 t,12 m,醒 v,睡眼惺忪 i,神志不清 i,但我 x,😅 x,香港 ns,街头 s,挂 v,国旗 n,迎国庆 nr"
4687047996737083,明日预判,Thu Sep 30 08:46:26 +0800 2021,#香港街头挂国旗迎国庆#湾湾也得挂上,香港 街头 挂 国旗 迎国庆 湾湾 也得 挂上,ns s v n nr x x x,"香港 ns,街头 s,挂 v,国旗 n,迎国庆 nr,湾湾 x,也得 x,挂上 x"
4687069282045923,叽叽咕丫,Thu Sep 30 10:11:01 +0800 2021,"#香港街头挂国旗迎国庆#
节日氛围超级浓厚","香港 街头 挂 国旗 迎国庆 
 节日 氛围 超级 浓厚",ns s v n nr x t n b a,"香港 ns,街头 s,挂 v,国旗 n,迎国庆 nr,
 x,节日 t,氛围 n,超级 b,浓厚 a"
4687064320968758,汀白萝卜,Thu Sep 30 09:51:18 +0800 2021,#香港街头挂国旗迎国庆#我也把国旗戴头上啦～,香港 街头 挂 国旗 迎国庆 戴 头上,ns s v n nr v s,"香港 ns,街头 s,挂 v,国旗 n,迎国庆 nr,戴 v,头上 s"
4687069224109443,晶报,Thu Sep 30 10:10:47 +0800 2021,【#内地居民赴香港商务签注在广东试行恢复办理#】记者29日从中华人民共和国出入境管理局获悉，自10月11日起，广东省内企业机构工作人员及个体工商户经营者赴香港从事商务活动的，可向广东省公安机关出入境管理部门申请办理赴香港商务签注，疫情中、高风险地区及申请前14天内有疫情中、高风险地区旅居史的人员除外。持商务签注人员应通过香港“来港易”计划前往香港，并自觉严格遵守相关主管部门关于防疫管理的规定要求。（来源：新华社客户端）#香港街头挂国旗迎国庆#,内地 居民 赴 香港 商务 签注 在广东 试行 恢复 办理 记者 29 中华人民共和国 出入境 管理局 获悉 10 11 日起 广东省 企业 机构 工作人员 个体工商户 经营者 商务活动 可向 公安机关 出入境管理 部门 申请 疫情 高风险 地区 前 14 天内 旅居 史 人员 持 应 来港 易 计划 前往 自觉 严格遵守 相关 主管部门 防疫 管理 来源 新华社 客户端 街头 挂 国旗 迎国庆,n n v ns n v x v v n n m ns l n v m m x ns n n n x n n v n x n v n n n f m s n ng n v v x a n t d nr v n vn vn n nt n s v n nr,"内地 n,居民 n,赴 v,香港 ns,商务 n,签注 v,在广东 x,试行 v,恢复 v,办理 n,记者 n,29 m,中华人民共和国 ns,出入境 l,管理局 n,获悉 v,10 m,11 m,日起 x,广东省 ns,企业 n,机构 n,工作人员 n,个体工商户 x,经营者 n,商务活动 n,可向 v,公安机关 n,出入境管理 x,部门 n,申请 v,疫情 n,高风险 n,地区 n,前 f,14 m,天内 s,旅居 n,史 ng,人员 n,持 v,应 v,来港 x,易 a,计划 n,前往 t,自觉 d,严格遵守 nr,相关 v,主管部门 n,防疫 vn,管理 vn,来源 n,新华社 nt,客户端 n,街头 s,挂 v,国旗 n,迎国庆 nr"
4687068715813080,郭施亮,Thu Sep 30 10:08:46 +0800 2021,#香港街头挂国旗迎国庆#国庆将至，香港的大街小巷悄然披上中国红，五星红旗和紫荆花旗交相辉映，欢乐祥和的节日气氛尽在其中。香港街头挂国旗迎国庆，国旗是我们每个中国人心中的骄傲与信仰。,香港 街头 挂 国旗 迎国庆 国庆 将至 大街小巷 悄然 披上 中国红 五星红旗 紫荆花 旗 交相辉映 欢乐祥和 节日 气氛 尽在 中国人 心中 骄傲 信仰,ns s v n nr t x i d v x nr nr n i i t n x x s a n,"香港 ns,街头 s,挂 v,国旗 n,迎国庆 nr,国庆 t,将至 x,大街小巷 i,悄然 d,披上 v,中国红 x,五星红旗 nr,紫荆花 nr,旗 n,交相辉映 i,欢乐祥和 i,节日 t,气氛 n,尽在 x,中国人 x,心中 s,骄傲 a,信仰 n"
4687050219455129,把我捏成软妹子,Thu Sep 30 08:55:16 +0800 2021,#香港街头挂国旗迎国庆#有生之年，希望可以看到收复台湾~,香港 街头 挂 国旗 迎国庆 有生之年 希望 可以看到 收复台湾,ns s v n nr l v x x,"香港 ns,街头 s,挂 v,国旗 n,迎国庆 nr,有生之年 l,希望 v,可以看到 x,收复台湾 x"
4687068137000616,乖味仙子,Thu Sep 30 10:06:28 +0800 2021,#香港街头挂国旗迎国庆# 昨天香港同事发来的利东街，就很巧🇨🇳,香港 街头 挂 国旗 迎国庆   昨天 同事 发来 利 东街 很巧 🇨 🇳,ns s v n nr x t n v n ns a x x,"香港 ns,街头 s,挂 v,国旗 n,迎国庆 nr,  x,昨天 t,同事 n,发来 v,利 n,东街 ns,很巧 a,🇨 x,🇳 x"
4687052194973414,苦瓜拌西瓜汁,Thu Sep 30 09:03:07 +0800 2021,#香港街头挂国旗迎国庆# 我现在只想看到把台湾的青天白日给换了，惯的臭毛病,香港 街头 挂 国旗 迎国庆   我现在 只想 台湾 青天白日 换了 惯 臭毛病,ns s v n nr x x x ns n x v x,"香港 ns,街头 s,挂 v,国旗 n,迎国庆 nr,  x,我现在 x,只想 x,台湾 ns,青天白日 n,换了 x,惯 v,臭毛病 x"
4686883772436411,大公報-大公網,Wed Sep 29 21:53:52 +0800 2021,#香港街头挂国旗迎国庆#【百人展巨型国旗　何君尧与KOL国庆齐祝愿】为庆祝新中国成立72周年及中国共产党成立100周年，今年国庆香港市面有着浓厚的节日气氛。由社区应急辅助队举办庆典大型国旗展示活动，在新界元朗惇裕学校草地足球场举行，展示30米乘以20米的超巨型国旗，由近100位义工及社区应急辅助队队员展开，覆盖了半个足球场。现场还由50名幼稚园学生组成的小龙队打鼓的精彩表演。适逢今年也是香港完善选举制度后成功举办首场选举，立法会议员何君尧及一众建设力量KOL对国庆有一些美好的祝愿。#国庆# 网页链接 大公文匯網的微博视频,香港 街头 挂 国旗 迎国庆 百人 展 巨型 　 何君尧 KOL 国庆 祝愿 庆祝 新中国成立 72 周年 中国共产党成立 100 市面 浓厚 节日 气氛 社区 应急 辅助 队 举办 庆典 大型 展示 活动 新界 元朗 惇 裕 学校 草地 足球场 30 米 乘以 20 超巨型 位 义工 队员 展开 覆盖 半个 现场 50 幼稚园 学生 小龙 打鼓 精彩表演 适逢 完善 选举制度 成功举办 首场 选举 立法会 议员 一众 建设 力量 有一些 美好   网页 链接 大公 文匯 網 微博 视频,ns s v n nr n v b x nr eng t v v x m t x m n a t n n vn vn n v ns b v vn n nr y vg n n n m m v m b v n n v v m n m n n nr v n v v x x n v j n n vn n x a x n n n x n a n,"香港 ns,街头 s,挂 v,国旗 n,迎国庆 nr,百人 n,展 v,巨型 b,　 x,何君尧 nr,KOL eng,国庆 t,祝愿 v,庆祝 v,新中国成立 x,72 m,周年 t,中国共产党成立 x,100 m,市面 n,浓厚 a,节日 t,气氛 n,社区 n,应急 vn,辅助 vn,队 n,举办 v,庆典 ns,大型 b,展示 v,活动 vn,新界 n,元朗 nr,惇 y,裕 vg,学校 n,草地 n,足球场 n,30 m,米 m,乘以 v,20 m,超巨型 b,位 v,义工 n,队员 n,展开 v,覆盖 v,半个 m,现场 n,50 m,幼稚园 n,学生 n,小龙 nr,打鼓 v,精彩表演 n,适逢 v,完善 v,选举制度 x,成功举办 x,首场 n,选举 v,立法会 j,议员 n,一众 n,建设 vn,力量 n,有一些 x,美好 a,  x,网页 n,链接 n,大公 n,文匯 x,網 n,微博 a,视频 n"
4687063418931866,农夫的下午茶,Thu Sep 30 09:47:43 +0800 2021,#香港街头挂国旗迎国庆#如果信念有颜色，那一定是中国红。,香港 街头 挂 国旗 迎国庆 信念 颜色 中国红,ns s v n nr n n x,"香港 ns,街头 s,挂 v,国旗 n,迎国庆 nr,信念 n,颜色 n,中国红 x"
4687067982070887,橘味汽泡Oo,Thu Sep 30 10:05:50 +0800 2021,#香港街头挂国旗迎国庆#祝祖国母亲生日快乐,香港 街头 挂 国旗 迎国庆 祝 祖国 母亲 生日快乐,ns s v n nr nr n n l,"香港 ns,街头 s,挂 v,国旗 n,迎国庆 nr,祝 nr,祖国 n,母亲 n,生日快乐 l"
4687066228590732,蓝鹿7M7,Thu Sep 30 09:58:52 +0800 2021,"#香港街头挂国旗迎国庆# 这不是应该的吗？一国两制，这是多么伟大的意义，都是中国人，还要像军阀割据拼个你死我活才能让对方诚服吗？我们是多么崇尚和平啊，和平来之不易，所以才不想轻易打仗，最后死的都是中国人，让外国人有机可乘。你不喜欢共产主义，那让你实行资本主义，只是大家都是中国人和平相处，一起安稳幸福生活，不好吗？看看其他国家颜色革命的下场，非要作死,，说的就是你，汉奸台湾!",香港 街头 挂 国旗 迎国庆   这不是 一国两制 是多么 的意义 都是 中国人 军阀割据 拼 你死我活 诚服 崇尚 和平 来之不易 不想 轻易 打仗 死 外国人 有机可乘 你不喜欢 共产主义 让你 实行 资本主义 大家都 是中国人 和平相处 安稳 幸福生活 不好 其他国家 颜色 革命 下场 非要 作死 汉奸 台湾,ns s v n nr x x l x x x x n v i a nrt nz i v a v v n l x n x v n x x i a i d x n vn n b v n ns,"香港 ns,街头 s,挂 v,国旗 n,迎国庆 nr,  x,这不是 x,一国两制 l,是多么 x,的意义 x,都是 x,中国人 x,军阀割据 n,拼 v,你死我活 i,诚服 a,崇尚 nrt,和平 nz,来之不易 i,不想 v,轻易 a,打仗 v,死 v,外国人 n,有机可乘 l,你不喜欢 x,共产主义 n,让你 x,实行 v,资本主义 n,大家都 x,是中国人 x,和平相处 i,安稳 a,幸福生活 i,不好 d,其他国家 x,颜色 n,革命 vn,下场 n,非要 b,作死 v,汉奸 n,台湾 ns"
4687065827247550,·伪造备忘录·,Thu Sep 30 09:57:17 +0800 2021,#香港街头挂国旗迎国庆#祖国母亲生日快乐！发挥一国两制制度优势实现人民对美好生活的向往,香港 街头 挂 国旗 迎国庆 祖国 母亲 生日快乐 发挥 一国两制 制度 优势 美好生活 向往,ns s v n nr n n l v l n n i d,"香港 ns,街头 s,挂 v,国旗 n,迎国庆 nr,祖国 n,母亲 n,生日快乐 l,发挥 v,一国两制 l,制度 n,优势 n,美好生活 i,向往 d"
4687063750020426,KiKi-WoW,Thu Sep 30 09:49:02 +0800 2021,"#香港街头挂国旗迎国庆#
不管有的人心里接不接受，都是事实哦最美的就是中国红","香港 街头 挂 国旗 迎国庆 
 有的人 接 不接受 都是 事实 最美 中国红",ns s v n nr x x v x x n a x,"香港 ns,街头 s,挂 v,国旗 n,迎国庆 nr,
 x,有的人 x,接 v,不接受 x,都是 x,事实 n,最美 a,中国红 x"
4687063431778336,-Sekhmet-,Thu Sep 30 09:47:46 +0800 2021,"#香港街头挂国旗迎国庆#武汉高架也全都是小国旗哟
还有小区单元门上挂着也是，国人的仪式感( ˃̶̤́ ꒳ ˂̶̤̀ )","香港 街头 挂 国旗 迎国庆 武汉 高架 
 小区 单元 门上 挂着 国人 仪式 感   ˃ ̶ ̤ ́ ꒳ ˂ ̀",ns s v n nr ns n x n n s x n n v x x x x x x x x,"香港 ns,街头 s,挂 v,国旗 n,迎国庆 nr,武汉 ns,高架 n,
 x,小区 n,单元 n,门上 s,挂着 x,国人 n,仪式 n,感 v,  x,˃ x,̶ x,̤ x,́ x,꒳ x,˂ x,̀ x"
4687056876340051,Fashion发现者,Thu Sep 30 09:21:43 +0800 2021,#香港街头挂国旗迎国庆#普天同庆的时刻即将到来！,香港 街头 挂 国旗 迎国庆 普天同庆 时刻 即将到来,ns s v n nr nr n x,"香港 ns,街头 s,挂 v,国旗 n,迎国庆 nr,普天同庆 nr,时刻 n,即将到来 x"
4687062655569330,Summer沁蒙主,Thu Sep 30 09:44:41 +0800 2021,#香港街头挂国旗迎国庆#我们都有一个家，名字叫中国🇨🇳,香港 街头 挂 国旗 迎国庆 都有 一个家 名字叫 中国 🇨 🇳,ns s v n nr x m x ns x x,"香港 ns,街头 s,挂 v,国旗 n,迎国庆 nr,都有 x,一个家 m,名字叫 x,中国 ns,🇨 x,🇳 x"
4687058175525607,叶大小姐,Thu Sep 30 09:26:53 +0800 2021,#香港街头挂国旗迎国庆# 中国红YYDS！🇨🇳 深圳,香港 街头 挂 国旗 迎国庆   中国红 YYDS 🇨 🇳 深圳,ns s v n nr x x eng x x ns,"香港 ns,街头 s,挂 v,国旗 n,迎国庆 nr,  x,中国红 x,YYDS eng,🇨 x,🇳 x,深圳 ns"
4687062542323823,闯进现现怀抱ing,Thu Sep 30 09:44:14 +0800 2021,#香港街头挂国旗迎国庆#什么时候可以通关啊，好久没去香港买买买了。。,香港 街头 挂 国旗 迎国庆 什么时候 通关 好久没 买买买,ns s v n nr x vn i x,"香港 ns,街头 s,挂 v,国旗 n,迎国庆 nr,什么时候 x,通关 vn,好久没 i,买买买 x"
4687046923520857,成长基金中最亮的星,Thu Sep 30 08:42:10 +0800 2021,开盘前最想说的是：我爱你中国，有一天这首歌会变老，就像老幺树上的枝芽，可我还会一遍遍歌唱　它如同我的生命，希望你能够知道你对我的意义　无论在何时何地你就像我的生命！#香港街头挂国旗迎国庆#,开盘 前 最想说 的是 我爱你 中国 有一天 首歌 变老 就像 老幺 树上 枝芽 可我 还会 一遍 遍 歌唱 　 生命 希望你 知道你 对我 的意义 何时何地 就像我 香港 街头 挂 国旗 迎国庆,v f x x l ns x n x x nr s n x x m v n x vn x x x x r x ns s v n nr,"开盘 v,前 f,最想说 x,的是 x,我爱你 l,中国 ns,有一天 x,首歌 n,变老 x,就像 x,老幺 nr,树上 s,枝芽 n,可我 x,还会 x,一遍 m,遍 v,歌唱 n,　 x,生命 vn,希望你 x,知道你 x,对我 x,的意义 x,何时何地 r,就像我 x,香港 ns,街头 s,挂 v,国旗 n,迎国庆 nr"
4687062139144426,云深忘羡兔,Thu Sep 30 09:42:38 +0800 2021,"#香港街头挂国旗迎国庆#
都是熟悉的地点
明天会更好，600天封关了，快快通关吧！！！","香港 街头 挂 国旗 迎国庆 
 都是 熟悉 地点 明天会更好 600 天 封关 快快 通关",ns s v n nr x x v n x m n v d vn,"香港 ns,街头 s,挂 v,国旗 n,迎国庆 nr,
 x,都是 x,熟悉 v,地点 n,明天会更好 x,600 m,天 n,封关 v,快快 d,通关 vn"
